<?xml version="1.0" encoding="utf-8"?>

<taller xmlns:xsi="http://www.w3.org/2001/XMLSchema-instance" xsi:noNamespaceSchemaLocation="ejer3.xsd">
    

    <marca id = "AB45GTX" />
    
    <matriz id ="DFX-D"> Renault Madrid </matriz>
    <coche>
        <marca>Porche</marca>
        <color>rojo</color>
    </coche>
    <mecanico especialidad="chapa">
        
        <nombre>Rodrigo</nombre>
        <apellido>Vivar</apellido>
    </mecanico>
    <mecanico especialidad="electrónica">
      
        <nombre>Rodrigo</nombre>
        <apellido>Vivar</apellido>
    </mecanico>
    <gerente>
        <nombre>Rodrigo</nombre>
        <apellido>Vivar</apellido>
    </gerente>
    
    <observaciones>
        <importancia>true</importancia>
        <fecha>2024-10-10</fecha>
        Este taller se dedica principalmente a la reparación de vehículos de alta gama
    </observaciones>
</taller>
